Test name,Test ID,Result,Comments
"TPM Support (Ubuntu)",TPM001.002,PASS,
"Verify TPM version (firmware)",TPM002.001,PASS,
"Verify TPM version (Ubuntu)",TPM002.002,PASS,
"Check TPM Physical Presence Interface (firmware)",TPM003.001,PASS,
"Check TPM Physical Presence Interface (Ubuntu)",TPM003.002,PASS,
"Detect TPM after platform reboot (Ubuntu)",TPD003.001,PASS,
"Detect TPM after platform suspend (Ubuntu)",TPD004.001,PASS,
"Verified boot support (Ubuntu)",VBO006.002,PASS,
"Booting from Slot A (Ubuntu)",VBO007.002,PASS,
"Booting from Recovery (Ubuntu)",VBO008.001,PASS,
"Recovery boot popup (firmware)",VBO009.001,PASS,
"Recovery boot popup confirmation (firmware)",VBO010.001,PASS,
"Recovery popup is not displayed when correctly signed firmware is flashed in RW_A",VBO011.001,PASS,
"Self-signed binary is bootable without errors",VBO012.001,PASS,
"BIOS lock support (Ubuntu)",BLS001.001,PASS,
"BIOS lock support deactivation (Ubuntu)",BLS002.001,PASS,
"Measured Boot support (Ubuntu)",MBO001.001,PASS,
"Check Secure Boot default state (firmware)",SBO001.001,PASS,
"UEFI Secure Boot (Ubuntu)",SBO002.001,PASS,
"Attempt to boot file with the correct key from Shell (firmware)",SBO003.001,PASS,
"Attempt to boot file without the key from Shell (firmware)",SBO004.001,FAIL,"skipped"
"Attempt to boot file with the wrong-signed key from Shell (firmware)",SBO005.001,PASS,
"Reset Secure Boot Keys option availability (firmware)",SBO006.001,PASS,
"Attempt to boot the file after restoring keys to default (firmware)",SBO007.001,PASS,
"Attempt to enroll the key in the incorrect format (firmware)",SBO008.001,PASS,
"Check Password Setup option availability and default state",PSW001.001,PASS,
"Password setting mechanism correctness checking",PSW002.001,PASS,
"Attempt to log in with a correct password",PSW003.001,PASS,
"Attempt to log in with an incorrect password",PSW004.001,PASS,
"Attempt to log in with an incorrect password 3 times",PSW005.001,PASS,
"Attempt to turn off setup password functionality",PSW006.001,PASS,
"Attempt to set non-compilant password",PSW007.001,PASS,
"Attempt to set old password",PSW008.001,PASS,
"Enable USB stack (firmware)",USS001.001,PASS,
"Disable USB stack (firmware)",USS002.001,PASS,
"Enable USB Mass Storage (firmware)",USS003.001,PASS,
"Disable USB Mass Storage (firmware)",USS004.001,PASS,
"Enable Network Boot (firmware)",NBA001.001,PASS,
"Disable Network Boot (firmware)",NBA002.001,PASS,
"SMM BIOS write protection enabling (Ubuntu)",SMM001.001,PASS,
"SMM BIOS write protection disabling (Ubuntu)",SMM002.001,PASS,
"Custom boot menu key",CBK001.001,PASS,
"Custom BIOS Menu Key",CBK002.001,PASS,
"USB devices detected in FW",USB001.001,PASS,
"USB devices detected by OS (Ubuntu)",USB001.002,PASS,
"USB keyboard detected in FW",USB002.001,PASS,"Accidental automated test, have to repeat manually"
"USB keyboard in OS (Ubuntu)",USB002.002,PASS,
"USB devices detection after cold boot (Ubuntu)",SUD0001.001,PASS,
"USB devices detection after warm boot (Ubuntu)",SUD0002.001,PASS,
"USB devices detection after reboot (Ubuntu)",SUD0003.001,PASS,
"USB devices detection after suspension (Ubuntu)",SUD0004.001,PASS,
"Only one iPXE in boot menu",CNB001.002,PASS,
"Boot into UEFI OS (Ubuntu)",EFI001.001,PASS,
"UEFI Shell",USH001.001,PASS,
"NVMe support in firmware",NVM001.001,PASS,
"NVMe support in OS (Ubuntu)",NVM001.002,PASS,
"NVMe detection after cold boot (Ubuntu)",SNV0001.001,PASS,
"NVMe detection after reboot (Ubuntu)",SNV0003.001,PASS,
"NVMe detection after suspension (Ubuntu)",SNV0004.001,PASS,
"Dasharo Network Boot is available",PXE001.001,PASS,
"Dasharo network boot menu boot options order is correct",PXE002.001,PASS,
"Autoboot option is available and works correctly",PXE003.001,PASS,
"DTS option is available and works correctly",PXE004.001,PASS,
"OS installation option is available and works correctly",PXE005.001,PASS,
"iPXE shell option is available and works correctly",PXE006.001,PASS,
"External HDMI display in OS (Ubuntu)",DSP002.001,PASS,
"External HDMI display in firmware",DSP002.003,PASS,
"External DP display in OS (Ubuntu)",DSP003.001,PASS,
"Audio subsystem detection (Ubuntu)",AUD001.001,PASS,
"External headset recognition (Ubuntu)",AUD004.001,PASS,
"External headset audio playback (Ubuntu)",AUD005.001,PASS,
"External headset audio capture (Ubuntu)",AUD006.001,PASS,
"HDMI audio recognition (Ubuntu)",AUD007.001,PASS,
"HDMI audio playback (Ubuntu)",AUD008.001,PASS,
"Cyclic platform suspend and resume (Ubuntu)",SUSP005.001,FAIL,"Suspected cause is decribed in this issue:
https://github.com/Dasharo/dasharo-issues/issues/1097"
"Verify the serial number",DMI001.001,PASS,
"Verify the firmware version",DMI002.001,PASS,
"Verify the firmware product name",DMI003.001,PASS,
"Verify the firmware release date",DMI004.001,PASS,
"Verify the firmware manufacturer",DMI005.001,PASS,
"Verify the firmware vendor",DMI006.001,PASS,
"eMMC support (Ubuntu)",MMC001.001,PASS,
"Ubuntu LTS installation on Hard Disk",LBT004.001,PASS,
"Boot Ubuntu From Hard Disk",LBT004.002,PASS,
"Check Power State After Power Failure default state (firmware)",PSF001.001,PASS,
"Powered Off State Restoration Test",PSF002.001,PASS,
"Powered On State Restoration Test",PSF003.001,PASS,
"Previous Power State Restoration Test - Powered Off",PSF004.001,PASS,
"Previous Power State Restoration Test - Powered On",PSF004.002,PASS,
"F9 resets Enable USB stack option to default",RTD001.001,PASS,
"F9 resets Enable USB Mass Storage driver option to default",RTD002.001,PASS,
"F9 resets Lock the BIOS boot medium option to default",RTD003.001,PASS,
"F9 resets Enable SMM BIOS write protection to default",RTD004.001,PASS,
"F9 resets Enable network boot to default",RTD006.001,NOT TESTED,
"Serial boot measure: coreboot booting time after cold boot",CBMEM001.001,PASS,
"Serial boot measure: coreboot booting time after warm boot",CBMEM002.001,PASS,
"Serial boot measure: coreboot booting time after system reboot",CBMEM003.001,PASS,
"CPU temperature without load (Ubuntu)",CPT001.001,PASS,
"CPU temperature after stress test (Ubuntu)",CPT002.001,PASS,
"CPU not stuck on initial frequency (Ubuntu)",CPF001.001,PASS,
"CPU runs on expected frequency (Ubuntu)",CPF002.001,PASS,
"CPU with load runs on expected frequency (Ubuntu)",CPF004.001,PASS,
"Change the UUID",DCU001.001,PASS,
"Change the serial number",DCU002.001,PASS,
"Change the bootsplash logo",DCU003.001,PASS,
"ESP Scan with OS-specific .efi files added",ESP001.001,PASS,
"ESP Scan after deleting additional .efi files",ESP002.001,PASS,
"ESP Scan ignores OSes on removable media",ESP003.001,PASS,
"ESP Scan does not create duplicate entries",ESP004.001,PASS,
"ESP Scan detects Dasharo Tools Suite",ESP005.001,PASS,
"Verify if no unexpected boot errors appear in Linux logs",STB002.001,PASS,
"CPU clock speed displayed in setup menu",SET001.001,PASS,
"RAM speed displayed in setup menu",SET002.001,PASS,
"RAM size displayed in setup menu",SET003.001,PASS,
"Expected CPU clock speed displayed in setup menu",SET004.001,PASS,
"Expected RAM speed displayed in setup menu",SET005.001,PASS,
"Expected RAM size displayed in setup menu",SET006.001,PASS,
"CPU works (Ubuntu)",CPU001.001,PASS,
"CPU cache enabled (Ubuntu)",CPU002.001,PASS,
"Multiple CPU support (Ubuntu)",CPU003.001,PASS,
"Multiple-core support (Ubuntu)",CPU004.001,PASS,
"Change Auto Boot Time-out and check after reboot",BMM001.001,PASS,
"F9 resets Auto Boot Time-out to default value",BMM002.001,PASS,
"Check Auto Boot Time-out option not accept non-numeric values",BMM003.001,PASS,
"Check if both SHA1 and SHA256 PCRs are enabled (Ubuntu)",TPMCMD001.001,FAIL,"SKIPPED"
"PCRREAD Function Verification (Ubuntu)",TPMCMD002.001,PASS,
"PCREXTEND And PCRRESET Functions (Ubuntu)",TPMCMD003.001,PASS,
"PCREXTEND And PCRRESET Functions - locality protections (Ubuntu)",TPMCMD003.002,PASS,
"PCREVENT Function (Ubuntu)",TPMCMD004.001,PASS,
"CREATEPRIMARY Function Verification (Ubuntu)",TPMCMD005.001,PASS,
"NVDEFINE and NVUNDEFINE Functions Verification (Ubuntu)",TPMCMD006.001,PASS,
"CREATE Function (Ubuntu)",TPMCMD007.001,PASS,
"CREATELOADED Function (Ubuntu)",TPMCMD007.002,PASS,
"Signing the file (Ubuntu)",TPMCMD008.001,PASS,
"Encryption and Decryption of the file (Ubuntu)",TPMCMD009.001,FAIL,"SKIPPED"
"Hashing the file (Ubuntu)",TPMCMD010.001,PASS,
"Performing HMAC operation on the file (Ubuntu)",TPMCMD011.001,PASS,
